Rk,Lg,Season,Count,Player List
96,ALNL,1969,24,Henry Aaron Matty Alou Rod Carew Rico Carty Roberto Clemente Willie Davis Richie Hebner Alex Johnson Cleon Jones Willie McCovey Manny Mota Tony Oliva Boog Powell Rich Reese Frank Robinson Pete Rose Manny Sanguillén Art Shamsky Reggie Smith Willie Stargell Rusty Staub Carl Taylor Bobby Tolan Walt Williams
97,ALNL,1974,24,Dick Allen Lou Brock Bill Buckner Jeff Burroughs Rod Carew Dave Cash Ralph Garr Steve Garvey Greg Gross Mike Hargrove Mike Jorgensen Elliott Maddox Bill Madlock Bake McBride Hal McRae Willie Montañez Al Oliver Jorge Orta Lou Piniella Lenny Randle Reggie Smith Willie Stargell Carl Yastrzemski Richie Zisk
98,ALNL,1964,23,Henry Aaron Dick Allen Lou Brock Rico Carty Orlando Cepeda Joe Christopher Roberto Clemente Ty Cline Curt Flood Bill Freehan Elston Howard Ron Hunt Mickey Mantle Lee Maye Tony Oliva Frank Robinson Floyd Robinson Brooks Robinson Ron Santo Willie Smith Joe Torre Bill White Billy Williams
99,ALNL,2019,23,Hanser Alberto Tim Anderson Nolan Arenado Cody Bellinger Charlie Blackmon Xander Bogaerts Michael Brantley Nelson Cruz David Dahl J.D. Davis Rafael Devers Howie Kendrick DJ LeMahieu Ketel Marte J.D. Martinez Jeff McNeil Whit Merrifield Yoán Moncada Kevin Newman Anthony Rendon Bryan Reynolds Gio Urshela Christian Yelich
100,ALNL,1944,22,Lou Boudreau Phil Cavarretta Walker Cooper Dom Dallessandro Bobby Doerr Pete Fox Augie Galan Tommy Holmes Johnny Hopp Bob Johnson Mike Kreevich Johnny Lindell Frank McCormick Joe Medwick Stan Musial Jim Russell Dick Siebert Stan Spence Snuffy Stirnweiss Eric Tipton Dixie Walker Phil Weintraub
101,ALNL,1959,22,Henry Aaron Ernie Banks Ken Boyer Orlando Cepeda Joe Cunningham Nellie Fox Tito Francona Al Kaline Harvey Kuenn Eddie Mathews Willie Mays Minnie Miñoso Wally Moon Vada Pinson Bobby Richardson Frank Robinson Pete Runnels Duke Snider Johnny Temple Bill Tuttle Bill White Gene Woodling
102,ALNL,1971,22,Henry Aaron Matty Alou Glenn Beckert Lou Brock Rod Carew Roberto Clemente Willie Davis Ralph Garr Cleon Jones Bobby Murcer Tony Oliva Amos Otis Joe Pepitone Merv Rettenmund Cookie Rojas Pete Rose Manny Sanguillén Ted Simmons Rusty Staub Joe Torre César Tovar Billy Williams
103,ALNL,1913,21,Home Run Baker Beals Becker Ty Cobb Eddie Collins Gavvy Cravath Sam Crawford Jake Daubert Chick Gandil Joe Jackson Nap Lajoie Hans Lobert Sherry Magee Stuffy McInnis Jack Meyers Clyde Milan Tris Speaker Joe Tinker Jim Viox Honus Wagner Zack Wheat Heinie Zimmerman
104,ALFLNL,1915,21,Vin Campbell Ty Cobb Eddie Collins Jake Daubert Larry Doyle Steve Evans William Fischer Max Flack Jack Fournier Tommy Griffith Bill Hinchman Joe Jackson Benny Kauff Ed Konetchy Fred Luderus Lee Magee Les Mann Stuffy McInnis Ward Miller Tris Speaker Bobby Veach
105,ALNL,1951,21,Richie Ashburn Bobby Ávila Roy Campanella Gil Coan Walker Cooper Al Dark Ferris Fain Nellie Fox Monte Irvin George Kell Ralph Kiner Peanuts Lowrey Gil McDougald Minnie Miñoso Stan Musial Johnny Pesky Jackie Robinson Vern Stephens Elmer Valo Ted Williams Johnny Wyrostek
106,ALNL,1978,21,Bill Buckner Jeff Burroughs Rod Carew Jack Clark Dave Concepción Cecil Cooper José Cruz Steve Garvey Mike Ivie Chet Lemon Bill Madlock José Morales Ben Oglivie Al Oliver Dave Parker Lou Piniella Jim Rice Gene Richards Leon Roberts Pete Rose Dave Winfield
107,NL,1900,20,Jimmy Barrett Jake Beckley Jesse Burkett Jimmy Collins George Davis Ed Delahanty Patsy Donovan Elmer Flick Buck Freeman Billy Hamilton Charlie Hickman Fielder Jones Willie Keeler Bill Keister Joe Kelley Nap Lajoie Kip Selbach Roy Thomas George Van Haltren Honus Wagner
108,ALNL,1946,20,Luke Appling Roy Cullenbine Dom DiMaggio Hank Edwards Del Ennis Tommy Holmes Johnny Hopp George Kell Whitey Kurowski Barney McCosky Johnny Mize Stan Musial Johnny Pesky Enos Slaughter Vern Stephens Elmer Valo Mickey Vernon Eddie Waitkus Dixie Walker Ted Williams
109,AANL,1891,19,Dan Brouthers Tom Brown Pete Browning Jack Clements Lave Cross Patsy Donovan Charlie Duffee Hugh Duffy Duke Farrell Billy Hamilton Bug Holliday Denny Lyons Tommy McCarthy Deacon McGuire John Milligan Tip O'Neill Mike Tiernan George Van Haltren George Wood
110,ALNL,1945,19,Phil Cavarretta Tony Cuccinello Johnny Dickshot Augie Galan Stan Hack Jeff Heath Tommy Holmes Don Johnson Whitey Kurowski Johnny Lazor Ernie Lombardi Tom McBride René Monteagudo Luis Olmo Mel Ott Goody Rosen Snuffy Stirnweiss Dixie Walker Jimmy Wasdell
111,ALNL,1957,19,Henry Aaron Bob Boyd Joe Cunningham Dee Fondy Nellie Fox Carl Furillo Dick Groat Mickey Mantle Willie Mays Minnie Miñoso Stan Musial Frank Robinson Red Schoendienst Roy Sievers Bob Skinner Bill Skowron Hal Smith Ted Williams Gene Woodling
112,ALNL,1981,19,Bill Almon Dusty Baker Bill Buckner Dave Concepción Cecil Cooper Andre Dawson Bobby Grich Ken Griffey Rickey Henderson Keith Hernandez Terry Kennedy Carney Lansford Gary Matthews Al Oliver Tom Paciorek Pete Rose Luis Salazar Mike Schmidt Willie Wilson
113,ALNL,2018,18,Jose Altuve Mookie Betts Michael Brantley Lorenzo Cain Corey Dickerson Freddie Freeman Scooter Gennett José Martínez J.D. Martinez Whit Merrifield Wilson Ramos Anthony Rendon Jean Segura Mike Trout Justin Turner Joey Wendle Christian Yelich Ben Zobrist
114,AANL,1886,17,Cap Anson Dan Brouthers Pete Browning Roger Connor Jack Glasscock George Gore Paul Hines King Kelly Henry Larkin Arlie Latham Alex McKinnon Tip O'Neill Jim O'Rourke Dave Orr Hardy Richardson Jack Rowe Sam Thompson
115,ALNL,1910,17,Johnny Bates Ty Cobb Eddie Collins Josh Devore Ted Easterly Solly Hofman John Knight Ed Konetchy Nap Lajoie Sherry Magee Danny Murphy Rube Oldring Dode Paskert Frank Schulte Fred Snodgrass Tris Speaker Honus Wagner
116,ALNL,1917,17,George Burns Ray Chapman Ty Cobb Happy Felsch Heinie Groh Joe Harris Rogers Hornsby Joe Jackson Benny Kauff Duffy Lewis Stuffy McInnis Sam Rice Edd Roush George Sisler Tris Speaker Bobby Veach Zack Wheat
117,ALNL,1952,17,Bobby Ávila Frank Baumholtz Al Dark Ferris Fain Dee Fondy Billy Goodman George Kell Ted Kluszewski Mickey Mantle Dale Mitchell Stan Musial Jackie Robinson Al Rosen Red Schoendienst Enos Slaughter Duke Snider Gene Woodling
118,ALNL,1967,17,Henry Aaron Dick Allen Matty Alou Orlando Cepeda Roberto Clemente Tommy Davis Curt Flood Tony González Al Kaline Manny Mota Frank Robinson Pete Rose Ron Santo George Scott Rusty Staub Maury Wills Carl Yastrzemski
119,ALNL,1906,16,Frank Chance Hal Chase Fred Clarke Bunk Congalton Elmer Flick Willie Keeler Johnny Kling Nap Lajoie Harry Lumley Danny Murphy Claude Rossman Socks Seybold Harry Steinfeldt George Stone Sammy Strang Honus Wagner
120,ALNL,1963,16,Henry Aaron Orlando Cepeda Roberto Clemente Wes Covington Tommy Davis Curt Flood Tony González Dick Groat Al Kaline Willie Mays Albie Pearson Vada Pinson Rich Rollins Bill White Maury Wills Carl Yastrzemski
121,ALNL,2021,16,Tim Anderson Michael Brantley Nick Castellanos Adam Frazier Freddie Freeman Vladimir Guerrero Jr. Yuli Gurriel Bryce Harper Nicky Lopez Starling Marte Buster Posey Bryan Reynolds Austin Riley Juan Soto Trea Turner Jesse Winker
122,ALNL,1916,15,Hal Chase Ty Cobb Eddie Collins Jake Daubert Happy Felsch Larry Gardner Bill Hinchman Rogers Hornsby Joe Jackson Dave Robertson George Sisler Tris Speaker Amos Strunk Bobby Veach Zack Wheat
123,ALNL,1942,15,George Case Joe DiMaggio Joe Gordon Stan Hack Wally Judnich Ernie Lombardi Joe Medwick Johnny Mize Stan Musial Lou Novikoff Johnny Pesky Pete Reiser Enos Slaughter Stan Spence Ted Williams
124,ALNL,1966,15,Dick Allen Felipe Alou Matty Alou Rico Carty Orlando Cepeda Roberto Clemente Tommy Davis Manny Mota Tony Oliva Frank Robinson Pete Rose Ron Santo Russ Snyder Willie Stargell Joe Torre
125,ALNL,1943,14,Luke Appling Walker Cooper Doc Cramer Bob Elliott Billy Herman Ralph Hodgin Ernie Lombardi Frank McCormick Stan Musial Bill Nicholson Arky Vaughan Dick Wakefield Dixie Walker Mickey Witek
126,ALNL,1965,14,Henry Aaron Dick Allen Roberto Clemente Donn Clendenon Gordy Coleman Vic Davalillo Curt Flood Willie Mays Tony Oliva Vada Pinson Cookie Rojas Pete Rose Billy Williams Carl Yastrzemski
127,ALNL,1905,13,John Barry Harry Bay Ginger Beaumont Roger Bresnahan Frank Chance Mike Donlin Elmer Flick Willie Keeler Cy Seymour Homer Smoot Roy Thomas John Titus Honus Wagner
128,ALNL,2022,13,José Abreu Jose Altuve Yordan Alvarez Luis Arráez Andrew Benintendi Xander Bogaerts Yonathan Daza Freddie Freeman Paul Goldschmidt Aaron Judge Nathaniel Lowe Jeff McNeil Harold Ramírez
129,AANL,1885,12,Cap Anson Tom Brown Pete Browning Roger Connor George Gore Ned Hanlon Charley Jones Henry Larkin Jim O'Rourke Dave Orr Harry Stovey Ezra Sutton
130,ALNL,1904,12,Ginger Beaumont Jake Beckley Bill Bradley Frank Chance Harry Davis Mike Donlin Elmer Flick Mike Grady Willie Keeler Nap Lajoie Cy Seymour Honus Wagner
131,ALNL,1918,12,Home Run Baker George Burns Ty Cobb Jake Daubert Heinie Groh Charlie Hollocher Edd Roush George Sisler Tris Speaker Buck Weaver Zack Wheat Ross Youngs
132,ALNL,1909,11,Home Run Baker Ty Cobb Eddie Collins Sam Crawford Larry Doyle Dick Hoblitzell Nap Lajoie Harry Lord Mike Mitchell Tris Speaker Honus Wagner
133,ALNL,1960,11,Ken Boyer Roberto Clemente Dick Groat Harvey Kuenn Norm Larker Willie Mays Minnie Miñoso Pete Runnels Bill Skowron Al Smith Ted Williams
134,ALNL,2023,11,Ronald Acuña Jr. Luis Arráez Cody Bellinger Mookie Betts Bo Bichette Yandy Díaz Freddie Freeman Josh Naylor Shohei Ohtani Harold Ramírez Corey Seager
135,ALNL,1907,10,Ginger Beaumont Ty Cobb Sam Crawford Elmer Flick Nap Lajoie Tommy Leach Sherry Magee Simon Nicholls George Stone Honus Wagner
136,NL,1892,9,Dan Brouthers Thomas Burns Cupid Childs Ed Delahanty Hugh Duffy Buck Ewing Billy Hamilton Jim O'Rourke Sam Thompson
137,AANL,1888,8,Cap Anson Dan Brouthers Hub Collins Buck Ewing King Kelly Tip O'Neill John Reilly Jimmy Ryan
138,ALNL,1908,8,Kitty Bransfield Ty Cobb Sam Crawford Mike Donlin Larry Doyle Johnny Evers Doc Gessler Honus Wagner
139,ALNL,1968,6,Felipe Alou Matty Alou Curt Flood Alex Johnson Pete Rose Carl Yastrzemski
