Rk,Lg,Season,Count,Player List
36,ALNL,2004,43,Bobby Abreu Garret Anderson Adrián Beltré Lance Berkman Barry Bonds Sean Casey Johnny Damon J.D. Drew Erubiel Durazo Jim Edmonds Johnny Estrada Julio Franco Marcus Giles Ross Gload Vladimir Guerrero Carlos Guillén Travis Hafner Todd Helton Shea Hillenbrand Raúl Ibañez Jason Kendall Mark Kotsay Carlos Lee Javy López Mark Loretta Melvin Mora David Ortiz Lyle Overbay Juan Pierre Albert Pujols Manny Ramírez Aramis Ramírez Juan Rivera Iván Rodríguez Scott Rolen Aaron Rowand J.T. Snow B.J. Surhoff Ichiro Suzuki Miguel Tejada Jack Wilson Tony Womack Michael Young
37,ALNL,1920,42,Ray Chapman Ty Cobb Shano Collins Eddie Collins Jake Daubert Joe Dugan Happy Felsch Max Flack Jack Fournier Larry Gardner Bucky Harris Harry Heilmann Harry Hooper Rogers Hornsby Joe Jackson Baby Doll Jacobson Charlie Jamieson Joe Judge Ed Konetchy Bob Meusel Irish Meusel Clyde Milan Hi Myers Steve O'Neill Del Pratt Sam Rice Dave Robertson Edd Roush Babe Ruth Wally Schang George Sisler Elmer Smith Earl Smith Tris Speaker Milt Stock Jack Tobin Bobby Veach Buck Weaver Zack Wheat Ken Williams Cy Williams Ross Youngs
38,NL,1897,41,John Anderson Jake Beckley Jesse Burkett Cupid Childs Fred Clarke Jimmy Collins Duff Cooley George Davis Harry Davis Ed Delahanty Gene DeMontreville Patsy Donovan Klondike Douglass Jack Doyle Hugh Duffy Kid Gleason Mike Griffin Billy Hamilton Fred Hartman Hughie Jennings Fielder Jones Bill Joyce Willie Keeler Joe Kelley George LaChance Nap Lajoie Bill Lange Herman Long Bobby Lowe John McGraw Dusty Miller Jimmy Ryan Kip Selbach Elmer Smith Chick Stahl Jake Stenzel Fred Tenney Mike Tiernan George Van Haltren Bobby Wallace Perry Werden
39,ALNL,1901,41,John Anderson Ginger Beaumont Jake Beckley Jesse Burkett Fred Clarke Jimmy Collins Sam Crawford Lave Cross Tom Daly George Davis Harry Davis Ed Delahanty Gene DeMontreville Mike Donlin Patsy Donovan Sam Dungan Kid Elberfeld Elmer Flick Buck Freeman Danny Green Fred Hartman Topsy Hartsel Emmet Heidrick Fielder Jones Willie Keeler Bill Keister Joe Kelley George LaChance Nap Lajoie Freddy Parent Ollie Pickering Socks Seybold Cy Seymour Jimmy Sheckard Chick Stahl Roy Thomas George Van Haltren Honus Wagner Irv Waldron Bobby Wallace Jimmy Williams
40,ALNL,1977,41,Bob Bailor Bruce Bochte Barry Bonnell Lyman Bostock George Brett Al Bumbry Rod Carew Cecil Cooper Al Cowens Dan Driessen Carlton Fisk George Foster Tito Fuentes Ralph Garr Ken Griffey Greg Gross Mike Hargrove George Hendrick Larry Hisle Roy Howell Tom Hutton Lamar Johnson Ron LeFlore Greg Luzinski Bill Madlock Bake McBride Thurman Munson Al Oliver Mitchell Page Dave Parker Lou Piniella Lenny Randle Jim Rice Mickey Rivers Bill Robinson Pete Rose Ted Simmons Ken Singleton Reggie Smith Rennie Stennett Garry Templeton
41,ALNL,1994,41,Roberto Alomar Moisés Alou Carlos Baerga Jeff Bagwell Bret Barberie Derek Bell Albert Belle Dante Bichette Craig Biggio Barry Bonds Bret Boone Brett Butler Will Clark Jeff Conine Chili Davis Jim Eisenreich Félix Fermín Julio Franco Andrés Galarraga Ken Griffey Jr. Tony Gwynn Darrin Jackson Gregg Jefferies David Justice Mike Kingery Chuck Knoblauch Kenny Lofton Fred McGriff Paul Molitor Raúl Mondesi Hal Morris Paul O'Neill Rafael Palmeiro Mike Piazza Kirby Puckett Cal Ripken Jr. Bip Roberts Sammy Sosa Frank Thomas Mo Vaughn Larry Walker
42,NL,1895,40,Cap Anson Jimmy Bannon Jake Beckley Steve Brodie Jesse Burkett Ed Cartwright Fred Clarke Roger Connor Duff Cooley George Davis Ed Delahanty Patsy Donovan Tommy Dowd Hugh Duffy Bill Everitt Buck Ewing Kid Gleason Mike Griffin Bill Hallman Billy Hamilton Hughie Jennings Bill Joyce Willie Keeler Joe Kelley George LaChance Bill Lange Arlie Latham Herman Long Deacon McGuire Ed McKean Dusty Miller Joe Quinn Jimmy Ryan Kip Selbach Germany Smith Elmer Smith Jake Stenzel Sam Thompson Mike Tiernan George Van Haltren
43,ALNL,1933,40,Luke Appling Earl Averill Wally Berger Ben Chapman Mickey Cochrane Ripper Collins Earle Combs Joe Cronin Virgil Davis Bill Dickey Jimmie Foxx Johnny Frederick Frankie Frisch Chick Fullis Lou Gehrig Charlie Gehringer Hank Greenberg Chick Hafey Pinky Higgins Johnny Hodapp Roy Johnson Chuck Klein Joe Kuhel Freddie Lindstrom Al López Heinie Manush Pepper Martin Joe Medwick Randy Moore Buddy Myer Tony Piet Babe Ruth Wes Schulmerich Al Simmons Evar Swanson Bill Terry Pie Traynor Arky Vaughan Paul Waner Sam West
44,NL,1896,39,John Anderson Cap Anson Eddie Burke Jesse Burkett Cupid Childs Fred Clarke Duff Cooley Bill Dahlen George Davis Ed Delahanty Gene DeMontreville Jim Donnelly Patsy Donovan Jack Doyle Hugh Duffy Bill Everitt Mike Griffin Bill Hallman Billy Hamilton Hughie Jennings Fielder Jones Bill Joyce Willie Keeler Joe Kelley Bill Lange Herman Long Denny Lyons Tom McCreery Deacon McGuire Ed McKean Bid McPhee Dusty Miller Jimmy Ryan Kip Selbach Elmer Smith Jake Stenzel Mike Tiernan Tommy Tucker George Van Haltren
45,ALNL,1975,39,Larry Biittner Larry Bowa Steve Braun George Brett Lou Brock José Cardenal Rod Carew Rico Carty Dave Cash Chris Chambliss Cecil Cooper Ron Fairly George Foster Steve Garvey Ken Griffey Mike Hargrove Jay Johnstone Von Joshua Ed Kranepool Lee Lacy Gene Locklear Greg Luzinski Fred Lynn Bill Madlock Bake McBride Hal McRae Willie Montañez Joe Morgan Thurman Munson Jorge Orta Dave Parker Jim Rice Pete Rose Manny Sanguillén Ted Simmons Ken Singleton Reggie Smith Claudell Washington Bob Watson
46,ALNL,1902,38,George Barclay Jimmy Barrett Ginger Beaumont Jake Beckley Bill Bradley Kitty Bransfield Jesse Burkett George Carey Fred Clarke Jimmy Collins Bill Coughlin Sam Crawford Lave Cross Harry Davis Ed Delahanty Patsy Donovan Patsy Dougherty Buck Freeman Dave Fultz Danny Green Charlie Hemphill Charlie Hickman Fielder Jones Willie Keeler Bill Keister Joe Kelley Dan McGann Heinie Peitz Jimmy Ryan Kip Selbach Socks Seybold Cy Seymour Jimmy Slagle Homer Smoot Chick Stahl Fred Tenney Honus Wagner Jimmy Williams
47,ALNL,1940,38,Luke Appling Johnny Cooney Doc Cramer Harry Danning Frank Demaree Joe DiMaggio Dom DiMaggio Lou Finney Debs Garms Charlie Gehringer Jim Gleeson Hank Greenberg Stan Hack Frankie Hayes Wally Judnich Ernie Koy Hank Leiber Buddy Lewis Ernie Lombardi Mike McCormick Frank McCormick Barney McCosky Joe Medwick Johnny Mize Terry Moore Wally Moses Rip Radcliff Larry Rosenthal Bama Rowell Enos Slaughter Moose Solters Cecil Travis Arky Vaughan Dixie Walker Roy Weatherly Ted Williams Taffy Wright Rudy York
48,ALNL,1979,38,Glenn Adams Bruce Bochte George Brett Lou Brock Rod Carew Dave Collins Cecil Cooper Brian Downing George Foster Oscar Gamble Steve Garvey Greg Gross George Hendrick Keith Hernandez Bob Horner Lamar Johnson Steve Kemp Ray Knight Ken Landreaux Ron LeFlore Chet Lemon Sixto Lezcano Fred Lynn Gary Matthews Lee Mazzilli Paul Molitor Charlie Moore Ken Oberkfell Al Oliver Dave Parker Larry Parrish Jim Rice Pete Rose Garry Templeton Bob Watson Rob Wilfong Willie Wilson Dave Winfield
49,ALNL,1983,38,Willie Aikens Don Baylor Wade Boggs Barry Bonnell George Brett Enos Cabell Rod Carew Cecil Cooper José Cruz Mike Easler Dave Engle Dámaso García Ken Griffey Greg Gross Mickey Hatcher George Hendrick Larry Herndon Bob Horner Ray Knight Lee Lacy Joe Lefebvre Bill Madlock Hal McRae Keith Moreland Lloyd Moseby Dale Murphy Eddie Murray Al Oliver Tom Paciorek Tony Peña Jim Rice Cal Ripken Jr. Ted Simmons Lonnie Smith Alan Trammell Willie Upshaw Lou Whitaker Robin Yount
50,ALNL,1984,38,Harold Baines Marty Barrett Buddy Bell Juan Beníquez Wade Boggs Phil Bradley Enos Cabell Dave Collins Tim Corcoran José Cruz Chili Davis Mike Easler Greg Gross Pedro Guerrero Tony Gwynn Mickey Hatcher Keith Hernandez Kent Hrbek Cliff Johnson Lee Lacy Carney Lansford Jeffrey Leonard Don Mattingly Hal McRae Rance Mulliniks Eddie Murray Al Oliver Terry Puhl Tim Raines Johnny Ray Cal Ripken Jr. Mickey Rivers Ryne Sandberg Scot Thompson Alan Trammell George Vukovich Willie Wilson Dave Winfield
51,ALNL,1970,37,Jesús Alou Luis Aparicio Bobby Bonds Lou Brock Bernie Carbo Rico Carty Danny Cater Orlando Cepeda Roberto Clemente Vic Davalillo Willie Davis Dick Dietz Ray Fosse Cito Gaston Jim Hickman Chuck Hinton Alex Johnson Denis Menke Félix Millán Manny Mota Thurman Munson Tony Oliva Wes Parker Tony Pérez Lou Piniella Merv Rettenmund Frank Robinson Pete Rose Joe Rudi Manny Sanguillén Reggie Smith Tony Taylor Bobby Tolan Joe Torre César Tovar Billy Williams Carl Yastrzemski
52,ALNL,1987,36,Mike Aldrete George Bell Wade Boggs Bobby Bonilla Will Clark Dave Concepción Kal Daniels Dwight Evans Tony Fernández Julio Franco Andrés Galarraga Mike Greenwell Pedro Guerrero Tony Gwynn Brook Jacoby Dion James John Kruk Mike LaValliere Don Mattingly Paul Molitor Rance Mulliniks Jerry Mumphrey Geno Petralli Kirby Puckett Tim Raines Willie Randolph Randy Ready Benito Santiago Kevin Seitzer Larry Sheets Ozzie Smith Pat Tabler Danny Tartabull Milt Thompson Alan Trammell Robin Yount
53,AANLPL,1890,34,Cap Anson Jake Beckley Lou Bierbauer Dan Brouthers Pete Browning Jesse Burkett Cupid Childs Roger Connor Hugh Duffy Dave Foutz Jack Glasscock Sandy Griffin Billy Hamilton Spud Johnson Joe Knight Henry Larkin Tommy McCarthy Mox McQuery Jack O'Connor Tip O'Neill Jim O'Rourke Dave Orr George Pinkney Joe Quinn John Reilly Hardy Richardson Jimmy Ryan Billy Shindle Ed Swartwood Harry Taylor Sam Thompson Mike Tiernan John Ward Chicken Wolf
54,ALFLNL,1914,34,Home Run Baker Beals Becker Hugh Bradley George Burns Vin Campbell Hal Chase Eddie Collins Joe Connolly Doc Crandall Sam Crawford Jack Dalton Jake Daubert Ted Easterly Steve Evans Jack Fournier Joe Jackson Benny Kauff Duke Kenworthy Frank LaPorte Ed Lennox William Louden Sherry Magee Tex McDonald Stuffy McInnis Bill McKechnie Benny Meyer Rebel Oakes Al Scheer Al Shaw Tris Speaker Casey Stengel Jimmy Walsh Zack Wheat Dutch Zwilling
55,ALNL,2012,34,Adrián Beltré Ryan Braun Billy Butler Miguel Cabrera Melky Cabrera Robinson Canó Allen Craig Prince Fielder Dexter Fowler Craig Gentry Carlos González Aaron Hill Torii Hunter Austin Jackson Jon Jay Derek Jeter Matt Kemp Jeff Keppinger Joe Mauer Andrew McCutchen Yadier Molina David Murphy Chris Nelson Jordan Pacheco Juan Pierre Buster Posey Martín Prado Aramis Ramírez Álex Ríos Carlos Ruiz Marco Scutaro Mike Trout Joey Votto David Wright
56,ALNL,1911,33,Home Run Baker Joe Birmingham Hal Chase Fred Clarke Ty Cobb Eddie Collins Sam Crawford Birdie Cree Jake Daubert Jim Delahanty Larry Doyle Art Fletcher Harry Hooper Joe Jackson Frank LaPorte Duffy Lewis Harry Lord Bris Lord Fred Luderus Stuffy McInnis Matty McIntyre Jack Meyers Clyde Milan Doc Miller Danny Murphy Germany Schaefer Frank Schulte Tris Speaker Bill Sweeney Honus Wagner Owen Wilson Harry Wolter Heinie Zimmerman
57,ALNL,1950,33,Richie Ashburn Hank Bauer Yogi Berra Ray Boone Gil Coan Walker Cooper Bob Dillinger Joe DiMaggio Dom DiMaggio Larry Doby Walt Dropo Bob Elliott Del Ennis Hoot Evers Carl Furillo Billy Goodman Sid Gordon Johnny Groth Johnny Hopp George Kell Ted Kluszewski Paul Lehner Hank Majeski Dale Mitchell Stan Musial Andy Pafko Johnny Pesky Phil Rizzuto Jackie Robinson Duke Snider Eddie Stanky Vic Wertz Al Zarilla
58,ALNL,2017,33,José Abreu Jose Altuve Nolan Arenado Charlie Blackmon Lorenzo Cain Starlin Castro Carlos Correa Freddie Freeman Avisaíl García Marwin González Bryce Harper Eric Hosmer Ender Inciarte DJ LeMahieu Adam Lind José Martínez J.D. Martinez Joe Mauer Daniel Murphy Eduardo Núñez Marcell Ozuna Gerardo Parra Tommy Pham Buster Posey José Ramírez Josh Reddick Anthony Rendon Jean Segura Dee Strange-Gordon Mike Trout Justin Turner Joey Votto Ryan Zimmerman
59,ALNL,1912,32,Home Run Baker Max Carey Ty Cobb Eddie Collins Sam Crawford Jake Daubert Larry Doyle Johnny Evers Chick Gandil Larry Gardner Miller Huggins Joe Jackson Jay Kirke Ed Konetchy Nap Lajoie Frank LaPorte Sherry Magee Armando Marsans Stuffy McInnis Fred Merkle Jack Meyers Clyde Milan Dode Paskert Del Pratt Tris Speaker Bill Sweeney John Titus Terry Turner Honus Wagner Zack Wheat Owen Wilson Heinie Zimmerman
60,ALNL,1976,32,Lyman Bostock George Brett Lou Brock Bill Buckner Rod Carew Rico Carty Willie Crawford José Cruz George Foster Ralph Garr Steve Garvey César Gerónimo Ken Griffey Jay Johnstone Ron LeFlore Greg Luzinski Fred Lynn Garry Maddox Bill Madlock Hal McRae Willie Montañez José Morales Joe Morgan Thurman Munson Al Oliver Dave Parker Tom Poquette Mickey Rivers Bill Robinson Pete Rose Joe Torre Bob Watson
61,ALNL,1986,32,Wally Backman Kevin Bass George Bell Juan Beníquez Tony Bernazard Wade Boggs Phil Bradley Chris Brown Joe Carter Mike Easler Tony Fernández Scott Fletcher Julio Franco Ken Griffey Tony Gwynn Ron Hassey Von Hayes Keith Hernandez John Kruk Rick Leach Don Mattingly Jerry Mumphrey Eddie Murray Kirby Puckett Tim Raines Johnny Ray Jim Rice Steve Sax Pat Tabler Denny Walling Gary Ward Robin Yount
62,ALNL,2011,32,José Bautista Carlos Beltrán Lance Berkman Ryan Braun Miguel Cabrera Melky Cabrera Robinson Canó Starlin Castro Jacoby Ellsbury Adrián González Alex Gordon Todd Helton Reed Johnson Matt Kemp Paul Konerko Casey Kotchman Victor Martinez Yadier Molina Nyjer Morgan Mike Morse Daniel Murphy Mike Napoli David Ortiz Dustin Pedroia Hunter Pence Brandon Phillips Aramis Ramírez José Reyes Pablo Sandoval Troy Tulowitzki Joey Votto Michael Young
63,NL,1898,31,Jesse Burkett Fred Clarke Jimmy Collins Duff Cooley Lave Cross George Davis Ed Delahanty Gene DeMontreville Charlie Dexter Patsy Donovan Bill Everitt Elmer Flick Mike Griffin Billy Hamilton Billy Hoy Hughie Jennings Fielder Jones Willie Keeler Joe Kelley Nap Lajoie Bill Lange Algie McBride Dan McGann John McGraw Henry Reitz Jimmy Ryan Kip Selbach Elmer Smith Chick Stahl Fred Tenney George Van Haltren
64,ALNL,1958,31,Henry Aaron Harry Anderson Richie Ashburn Ernie Banks Bob Boyd Ken Boyer Orlando Cepeda Bob Cerv Rocky Colavito Joe Cunningham Nellie Fox Dick Groat Elston Howard Al Kaline Harvey Kuenn Jerry Lynch Mickey Mantle Willie Mays Minnie Miñoso Stan Musial Bob Nieman Russ Nixon Vic Power Pete Runnels Norm Siebern Bob Skinner Duke Snider Johnny Temple Frank Torre Lee Walls Ted Williams
65,ALNL,1991,31,Wade Boggs Bobby Bonilla Iván Calderón Will Clark Jim Eisenreich Julio Franco Mike Greenwell Ken Griffey Jr. Tony Gwynn Darryl Hamilton Brian Harper Félix José Wally Joyner Barry Larkin Shane Mack Edgar Martínez Willie McGee Paul Molitor Hal Morris Rafael Palmeiro Terry Pendleton Kirby Puckett Willie Randolph Cal Ripken Jr. Chris Sabo Steve Sax Rubén Sierra Danny Tartabull Frank Thomas Milt Thompson Jeff Treadway
66,AANL,1889,30,Cap Anson Jake Beckley Lou Bierbauer Dan Brouthers Thomas Burns Jim Burns Roger Connor Hugh Duffy Jack Glasscock George Gore Billy Hamilton Paul Hines Bug Holliday Henry Larkin Denny Lyons Lefty Marr Ed McKean Darby O'Brien Tip O'Neill Jim O'Rourke Dave Orr Blondie Purcell Hardy Richardson Jimmy Ryan Emmett Seery Billy Shindle Harry Stovey Mike Tiernan Tommy Tucker George Van Haltren
67,NL,1899,30,Ginger Beaumont Jake Beckley Steve Brodie Jesse Burkett Fred Clarke Tom Daly George Davis Ed Delahanty Bill Everitt Elmer Flick Buck Freeman Emmet Heidrick Ducky Holmes Billy Hoy Willie Keeler Bill Keister Joe Kelley George LaChance Bill Lange Jack McCarthy Tom McCreery John McGraw Claude Ritchey Jimmy Ryan Chick Stahl Fred Tenney Roy Thomas George Van Haltren Honus Wagner Jimmy Williams
68,ALNL,1973,30,Henry Aaron Ron Blomberg Al Bumbry José Cardenal Rod Carew César Cedeño Rich Coggins Tommy Davis Dan Driessen Steve Garvey Ed Goodson Johnny Grubb Willie Horton Ron Hunt Garry Maddox Gary Matthews Dave May Thurman Munson Bobby Murcer Jim Northrup Amos Otis Tony Pérez Pete Rose Richie Scheinblum George Scott Ted Simmons Ken Singleton Reggie Smith Bob Watson Richie Zisk
69,ALNL,1990,30,Wade Boggs Barry Bonds George Brett Brett Butler Jack Daugherty Andre Dawson Bill Doran Mariano Duncan Lenny Dykstra Ron Gant Mark Grace Ken Griffey Jr. Tony Gwynn Lenny Harris Rickey Henderson Barry Larkin Shane Mack Dave Magadan Edgar Martínez Willie McGee Fred McGriff Hal Morris Eddie Murray Rafael Palmeiro Luis Polonia Bip Roberts Ryne Sandberg Mackey Sasser Lonnie Smith Alan Trammell
70,ALNL,2013,30,Adrián Beltré Miguel Cabrera Robinson Canó Matt Carpenter Allen Craig Michael Cuddyer Josh Donaldson Freddie Freeman Paul Goldschmidt Carlos González Matt Holliday Eric Hosmer Torii Hunter Jose Iglesias Omar Infante Chris Johnson Victor Martinez Joe Mauer Andrew McCutchen Yadier Molina Daniel Nava David Ortiz Dustin Pedroia Jhonny Peralta Yasiel Puig Mike Trout Troy Tulowitzki Joey Votto Jayson Werth David Wright
71,AANL,1887,29,Ed Andrews Cap Anson Dan Brouthers Pete Browning Thomas Burns Fred Carroll Charlie Comiskey John Corkhill Jumbo Davis Jerry Denny Dave Foutz Mike Griffin Paul Hines King Kelly Henry Larkin Arlie Latham Denny Lyons Reddy Mack Darby O'Brien Tip O'Neill John Reilly Hardy Richardson William Robinson Jack Rowe Otto Schomberg Sam Thompson John Ward Deacon White Sam Wise
72,ALNL,1954,29,Joe Adcock Richie Ashburn Bobby Ávila Yogi Berra Smoky Burgess Andy Carey Jim Finigan Nellie Fox Billy Goodman Sid Gordon Solly Hemus Gil Hodges Ted Kluszewski Harvey Kuenn Mickey Mantle Willie Mays Minnie Miñoso Wally Moon Don Mueller Stan Musial Irv Noren Pee Wee Reese Jackie Robinson Al Rosen Bill Sarni Red Schoendienst Duke Snider Johnny Temple Ted Williams
73,ALNL,1962,29,Henry Aaron Felipe Alou George Altman Richie Ashburn Smoky Burgess Johnny Callison Orlando Cepeda Roberto Clemente Tommy Davis Don Demeter Tony González Chuck Hinton Manny Jiménez Al Kaline Harvey Kuenn Jerry Lumpe Mickey Mantle Willie Mays Stan Musial Bobby Richardson Frank Robinson Floyd Robinson Brooks Robinson Pete Runnels Norm Siebern Bob Skinner Russ Snyder Frank Torre Bill White
74,ALNL,1982,29,Dusty Baker Wade Boggs George Brett Bill Buckner Rod Carew Cecil Cooper Andre Dawson Doug DeCinces Leon Durham Dámaso García Pedro Guerrero Toby Harrah Kent Hrbek Lee Lacy Carney Lansford Rudy Law John Lowenstein Bill Madlock Hal McRae Paul Molitor Jerry Mumphrey Eddie Murray Al Oliver Tom Paciorek Lou Piniella Jim Rice Lonnie Smith Willie Wilson Robin Yount
75,ALNL,2010,29,Mike Aviles Adrián Beltré Ryan Braun Billy Butler Miguel Cabrera Robinson Canó Starlin Castro Shin-Soo Choo Carl Crawford Nelson Cruz Carlos González Vladimir Guerrero Josh Hamilton Matt Holliday Omar Infante Jon Jay Paul Konerko Victor Martinez Joe Mauer Buster Posey Martín Prado Albert Pujols Hanley Ramírez Carlos Ruiz Ichiro Suzuki Troy Tulowitzki Joey Votto Kevin Youkilis Ryan Zimmerman
76,NL,1893,28,Cap Anson Jake Beckley Steve Brodie Jesse Burkett Cupid Childs Roger Connor Bill Dahlen George Davis Ed Delahanty Patsy Donovan Hugh Duffy Buck Ewing Jack Glasscock Bill Hallman Bug Holliday Joe Kelley Denny Lyons Tommy McCarthy John McGraw Ed McKean Tim O'Rourke Elmer Smith Patsy Tebeau Sam Thompson Mike Tiernan George Van Haltren John Ward Sam Wise
77,ALNL,1941,28,Luke Appling Jimmy Brown Sam Chapman Johnny Cooney Joe Cronin Roy Cullenbine Joe DiMaggio Nick Etten Jimmie Foxx Joe Grace Stan Hack Jeff Heath Johnny Hopp Danny Litwhiler Barney McCosky Joe Medwick Johnny Mize Wally Moses Rip Radcliff Pete Reiser Phil Rizzuto Dick Siebert Enos Slaughter Cecil Travis Arky Vaughan Dixie Walker Ted Williams Taffy Wright
78,ALNL,1953,28,Richie Ashburn Hank Bauer Frank Baumholtz Gus Bell Jim Busby Roy Campanella Al Dark Dee Fondy Carl Furillo Billy Goodman Gil Hodges Monte Irvin George Kell Ted Kluszewski Harvey Kuenn Eddie Mathews Minnie Miñoso Dale Mitchell Don Mueller Stan Musial Dave Philley Jackie Robinson Al Rosen Red Schoendienst Duke Snider Hank Thompson Mickey Vernon Gene Woodling
79,ALNL,2016,28,Jose Altuve Elvis Andrus Adrián Beltré Mookie Betts Charlie Blackmon Ryan Braun Miguel Cabrera Aledmys Díaz Yunel Escobar Freddie Freeman DJ LeMahieu Francisco Lindor Starling Marte J.D. Martinez Yadier Molina Daniel Murphy Paulo Orlando David Ortiz Dustin Pedroia Martín Prado José Ramírez Wilson Ramos J.T. Realmuto Corey Seager Jean Segura Devon Travis Mike Trout Joey Votto
80,ALNL,1903,27,Jimmy Barrett Ginger Beaumont Jake Beckley Bill Bradley Roger Bresnahan George Browne Frank Chance Fred Clarke Sam Crawford Mike Donlin Patsy Donovan Patsy Dougherty Jack Doyle Kid Elberfeld Danny Green Willie Keeler Bill Keister Joe Kelley Nap Lajoie Freddy Parent Cy Seymour Jimmy Sheckard Harry Steinfeldt Fred Tenney Roy Thomas Honus Wagner Harry Wolverton
81,ALNL,1988,27,Wade Boggs George Brett José Canseco Andre Dawson Julio Franco Gary Gaetti Andrés Galarraga Dave Gallagher Mike Greenwell Tony Gwynn Dave Henderson Rickey Henderson Kent Hrbek Don Mattingly Paul Molitor John Moses Rance Mulliniks Rafael Palmeiro Gerald Perry Kirby Puckett Terry Puhl Johnny Ray Kevin Seitzer Alan Trammell Claudell Washington Dave Winfield Robin Yount
82,ALNL,1989,27,Harold Baines Wade Boggs Will Clark Alvin Davis Jim Dwyer Julio Franco Mark Grace Mike Greenwell Pedro Guerrero Tony Gwynn Brian Harper Danny Heep Roberto Kelly John Kruk Carney Lansford Carlos Martínez Don Mattingly Paul Molitor Luis Polonia Kirby Puckett Harold Reynolds Bip Roberts Steve Sax Rubén Sierra Dwight Smith Lonnie Smith Robin Yount
83,ALNL,1947,26,Luke Appling Lou Boudreau Phil Cavarretta Walker Cooper Joe DiMaggio Bob Elliott Augie Galan Tommy Holmes George Kell Ralph Kiner Whitey Kurowski Phil Masi Barney McCosky George McQuinn Sam Mele Dale Mitchell Johnny Mize Stan Musial Andy Pafko Johnny Pesky Pete Reiser Elmer Valo Harry Walker Dixie Walker Ted Williams Taffy Wright
84,ALNL,1948,26,Luke Appling Richie Ashburn Yogi Berra Lou Boudreau Bobby Brown Al Dark Bob Dillinger Joe DiMaggio Larry Doby Hoot Evers Billy Goodman Jeff Heath Tommy Henrich Tommy Holmes Hank Majeski Mike McCormick Barney McCosky Dale Mitchell Stan Musial Andy Pafko Bob Scheffing Enos Slaughter Elmer Valo Dixie Walker Ted Williams Al Zarilla
85,ALNL,1985,26,Harold Baines Juan Beníquez Wade Boggs Thad Bosley Phil Bradley George Brett Mike Brown Brett Butler José Cruz Pedro Guerrero Tony Gwynn Rickey Henderson Keith Hernandez Tom Herr Garth Iorg Don Mattingly Willie McGee Keith Moreland Dale Murphy Joe Orsulak Dave Parker Tim Raines Floyd Rayford Mark Salas Ryne Sandberg Wayne Tolleson
86,ALNL,1919,25,George Burns Ray Chapman Ty Cobb Eddie Collins Larry Gardner Heinie Groh Harry Heilmann Rogers Hornsby Joe Jackson Baby Doll Jacobson Doc Johnston Nemo Leibold Stuffy McInnis Irish Meusel Hi Myers Roger Peckinpaugh Sam Rice Edd Roush Babe Ruth Wally Schang George Sisler Milt Stock Jack Tobin Bobby Veach Ross Youngs
87,ALNL,1949,25,Luke Appling Bob Dillinger Dom DiMaggio Bobby Doerr Del Ennis Hoot Evers Carl Furillo Johnny Hopp Nippy Jones George Kell Ralph Kiner Ted Kluszewski Whitey Lockman Willard Marshall Cass Michaels Dale Mitchell Stan Musial Johnny Pesky Jackie Robinson Roy Sievers Enos Slaughter Bobby Thomson Harry Walker Vic Wertz Ted Williams
88,ALNL,1956,25,Henry Aaron Richie Ashburn Ed Bailey Ray Boone Ken Boyer Roberto Clemente Clint Courtney Jim Gilliam Jackie Jensen Al Kaline Ted Kluszewski Harvey Kuenn Mickey Mantle Charlie Maxwell Gil McDougald Minnie Miñoso Stan Musial Bob Nieman Vic Power Pete Runnels Red Schoendienst Bill Skowron Mickey Vernon Bill Virdon Ted Williams
89,ALNL,1961,25,Henry Aaron George Altman Earl Battey Ken Boyer Smoky Burgess Norm Cash Orlando Cepeda Roberto Clemente Ron Fairly Curt Flood Tito Francona Jim Gentile Elston Howard Al Kaline Mickey Mantle Eddie Mathews Willie Mays Wally Moon Jim Piersall Vada Pinson Frank Robinson Floyd Robinson Pete Runnels Dick Stuart Gene Woodling
90,ALNL,1972,25,Dick Allen Matty Alou Dusty Baker Lou Brock Bill Buckner Rod Carew César Cedeño Roberto Clemente Gene Clines Vic Davalillo Ralph Garr Richie Hebner Al Kaline Leron Lee Carlos May Manny Mota Al Oliver Lou Piniella Pete Rose Joe Rudi Ron Santo Richie Scheinblum Ted Simmons Bob Watson Billy Williams
91,ALNL,1992,25,Roberto Alomar Carlos Baerga Barry Bonds Mike Bordick Brett Butler Will Clark Bernard Gilkey Mark Grace Ken Griffey Jr. Tony Gwynn Brian Harper John Kruk Barry Larkin Shane Mack Edgar Martínez Paul Molitor Terry Pendleton Kirby Puckett Bip Roberts Ryne Sandberg Mike Sharperson Gary Sheffield Frank Thomas Andy Van Slyke Larry Walker
92,ALNL,2014,25,José Abreu Jose Altuve Adrián Beltré Michael Brantley Miguel Cabrera Melky Cabrera Lorenzo Cain Robinson Canó Carl Crawford Corey Dickerson Adam Eaton Paul Goldschmidt Josh Harrison Jon Jay Jonathan Lucroy J.D. Martinez Victor Martinez Andrew McCutchen Justin Morneau Buster Posey Ben Revere Danny Santana Denard Span Justin Turner Juan Uribe
93,ALNL,2015,25,Jose Altuve Xander Bogaerts Michael Brantley Miguel Cabrera Lorenzo Cain Chris Colabello Nelson Cruz Yunel Escobar Prince Fielder Paul Goldschmidt Bryce Harper Nick Hundley Jose Iglesias Ender Inciarte Jason Kipnis DJ LeMahieu Joe Panik David Peralta A.J. Pierzynski AJ Pollock Buster Posey Ben Revere Dee Strange-Gordon Joey Votto Christian Yelich
94,AANLUA,1884,24,Cap Anson Sam Barkley Pete Browning Roger Connor Abner Dalrymple Fred Dunlap Dude Esterbrook Jack Glasscock George Gore Paul Hines Charley Jones King Kelly Henry Moore Jim O'Rourke Dave Orr John Reilly Hardy Richardson Jumbo Schoeneck Emmett Seery Orator Shafer Harry Stovey Ezra Sutton Deacon White Chicken Wolf
95,ALNL,1955,24,Henry Aaron Richie Ashburn Gus Bell Smoky Burgess Roy Campanella Nellie Fox Carl Furillo Al Kaline George Kell Ted Kluszewski Harvey Kuenn Mickey Mantle Willie Mays Don Mueller Stan Musial Wally Post Vic Power Harry Simpson Bill Skowron Enos Slaughter Al Smith Duke Snider Elmer Valo Mickey Vernon
